{
  "schemaVersion": 1,
  "inventoryRoots": [
    {
      "path": "mvp/src",
      "kind": "source"
    },
    {
      "path": "flock-voice-engine/client",
      "kind": "legacy-client"
    },
    {
      "path": "mvp/test",
      "kind": "test"
    },
    {
      "path": "flock-voice-engine/runtime/src/legacy",
      "kind": "legacy-runtime"
    },
    {
      "path": "flock-voice-engine/runtime/test/legacy",
      "kind": "test"
    }
  ],
  "referenceTestRoots": [
    "flock-voice-engine/runtime/test"
  ],
  "literalFiles": [
    {
      "path": "flock-voice-engine/server/app.py",
      "kind": "source"
    },
    {
      "path": "flock-voice-engine/deploy/docker-run.sh",
      "kind": "legacy-deploy"
    },
    {
      "path": "flock-voice-engine/runtime/src/api/legacy-routes.js",
      "kind": "legacy-runtime"
    }
  ],
  "files": [
    {
      "path": "flock-voice-engine/client/demo.html",
      "kind": "legacy-client",
      "currentOwner": "browser",
      "replacementPath": "mvp/src/server-main.js",
      "replacementOwner": "server",
      "status": "retired",
      "retireAfterGate": "phase6"
    },
    {
      "path": "flock-voice-engine/client/map.html",
      "kind": "legacy-client",
      "currentOwner": "browser",
      "replacementPath": "mvp/src/server-main.js",
      "replacementOwner": "server",
      "status": "retired",
      "retireAfterGate": "phase6"
    },
    {
      "path": "flock-voice-engine/client/pcm-player-worklet.js",
      "kind": "legacy-client",
      "currentOwner": "browser",
      "replacementPath": "mvp/src/server-main.js",
      "replacementOwner": "server",
      "status": "retired",
      "retireAfterGate": "phase6"
    },
    {
      "path": "flock-voice-engine/client/tracks.html",
      "kind": "legacy-client",
      "currentOwner": "browser",
      "replacementPath": "mvp/src/server-main.js",
      "replacementOwner": "server",
      "status": "retired",
      "retireAfterGate": "phase6"
    },
    {
      "path": "flock-voice-engine/client/voice-client-production.js",
      "kind": "legacy-client",
      "currentOwner": "browser",
      "replacementPath": "mvp/src/server-main.js",
      "replacementOwner": "server",
      "status": "retired",
      "retireAfterGate": "phase6"
    },
    {
      "path": "flock-voice-engine/client/voice-client.js",
      "kind": "legacy-client",
      "currentOwner": "browser",
      "replacementPath": "mvp/src/server-main.js",
      "replacementOwner": "server",
      "status": "retired",
      "retireAfterGate": "phase6"
    },
    {
      "path": "flock-voice-engine/deploy/docker-run.sh",
      "kind": "legacy-deploy",
      "currentOwner": "browser",
      "replacementPath": "flock-voice-engine/deploy/release.sh",
      "replacementOwner": "server",
      "status": "retired",
      "retireAfterGate": "phase6"
    },
    {
      "path": "flock-voice-engine/runtime/src/api/legacy-routes.js",
      "kind": "legacy-runtime",
      "currentOwner": "browser",
      "replacementPath": "flock-voice-engine/runtime/src/api/bootstrap.js",
      "replacementOwner": "server",
      "status": "retired",
      "retireAfterGate": "phase6"
    },
    {
      "path": "flock-voice-engine/runtime/src/legacy/audio-owner.js",
      "kind": "legacy-runtime",
      "currentOwner": "browser",
      "replacementPath": "flock-voice-engine/runtime/src/audio/audio-planner.js",
      "replacementOwner": "server",
      "status": "retired",
      "retireAfterGate": "phase6"
    },
    {
      "path": "flock-voice-engine/runtime/src/legacy/decoder-adapter.js",
      "kind": "legacy-runtime",
      "currentOwner": "browser",
      "replacementPath": "flock-voice-engine/runtime/src/api/audio-ws.js",
      "replacementOwner": "server",
      "status": "retired",
      "retireAfterGate": "phase6"
    },
    {
      "path": "flock-voice-engine/runtime/src/legacy/decoder-session-registry.js",
      "kind": "legacy-runtime",
      "currentOwner": "browser",
      "replacementPath": "flock-voice-engine/runtime/src/audio/audio-client-writer.js",
      "replacementOwner": "server",
      "status": "retired",
      "retireAfterGate": "phase6"
    },
    {
      "path": "flock-voice-engine/runtime/src/legacy/write-access.js",
      "kind": "legacy-runtime",
      "currentOwner": "browser",
      "replacementPath": "flock-voice-engine/runtime/src/audio/audio-control-barrier.js",
      "replacementOwner": "server",
      "status": "retired",
      "retireAfterGate": "phase6"
    },
    {
      "path": "flock-voice-engine/runtime/test/api/static-ui.test.js",
      "kind": "test",
      "currentOwner": "test",
      "status": "retained",
      "reason": "retired dependency reference must be migrated before Phase 6"
    },
    {
      "path": "flock-voice-engine/runtime/test/audio/worker-supervisor.integration.test.js",
      "kind": "test",
      "currentOwner": "test",
      "status": "retained",
      "reason": "retired dependency reference must be migrated before Phase 6"
    },
    {
      "path": "flock-voice-engine/runtime/test/domain-parity.test.js",
      "kind": "test",
      "currentOwner": "test",
      "status": "retained",
      "reason": "retired dependency reference must be migrated before Phase 6"
    },
    {
      "path": "flock-voice-engine/runtime/test/domain/test-migration.test.js",
      "kind": "test",
      "currentOwner": "test",
      "status": "retained",
      "reason": "retired dependency reference must be migrated before Phase 6"
    },
    {
      "path": "flock-voice-engine/runtime/test/integration/phase34-shadow.test.js",
      "kind": "test",
      "currentOwner": "test",
      "status": "retained",
      "reason": "retired dependency reference must be migrated before Phase 6"
    },
    {
      "path": "flock-voice-engine/runtime/test/integration/phase5-local.test.js",
      "kind": "test",
      "currentOwner": "test",
      "status": "retained",
      "reason": "retired dependency reference must be migrated before Phase 6"
    },
    {
      "path": "flock-voice-engine/runtime/test/legacy/audio-owner.test.js",
      "kind": "test",
      "currentOwner": "test",
      "status": "retained",
      "reason": "semantic replacement test-name coverage is pending; legacy regression remains active"
    },
    {
      "path": "flock-voice-engine/runtime/test/legacy/decoder-session.test.js",
      "kind": "test",
      "currentOwner": "test",
      "status": "retained",
      "reason": "semantic replacement test-name coverage is pending; legacy regression remains active"
    },
    {
      "path": "flock-voice-engine/runtime/test/legacy/legacy-adapter.integration.test.js",
      "kind": "test",
      "currentOwner": "test",
      "status": "retained",
      "reason": "semantic replacement test-name coverage is pending; legacy regression remains active"
    },
    {
      "path": "flock-voice-engine/runtime/test/phase6-test-migration.test.js",
      "kind": "test",
      "currentOwner": "test",
      "status": "retained",
      "reason": "retired dependency reference must be migrated before Phase 6"
    },
    {
      "path": "flock-voice-engine/runtime/test/security/production-bundle-boundary.test.js",
      "kind": "test",
      "currentOwner": "test",
      "status": "retained",
      "reason": "retired dependency reference must be migrated before Phase 6"
    },
    {
      "path": "flock-voice-engine/runtime/test/shadow-oracle-import-closure.test.js",
      "kind": "test",
      "currentOwner": "test",
      "status": "retained",
      "reason": "retired dependency reference must be migrated before Phase 6"
    },
    {
      "path": "flock-voice-engine/runtime/test/shadow-replay.test.js",
      "kind": "test",
      "currentOwner": "test",
      "status": "retained",
      "reason": "retired dependency reference must be migrated before Phase 6"
    },
    {
      "path": "flock-voice-engine/server/app.py",
      "kind": "source",
      "currentOwner": "browser",
      "replacementPath": "flock-voice-engine/server/audio_worker/__main__.py",
      "replacementOwner": "server",
      "status": "retired",
      "retireAfterGate": "phase6"
    },
    {
      "path": "mvp/src/agent.js",
      "kind": "source",
      "currentOwner": "browser",
      "replacementPath": "flock-voice-engine/runtime/src/simulation-runtime.js",
      "replacementOwner": "server",
      "status": "retired",
      "retireAfterGate": "phase6"
    },
    {
      "path": "mvp/src/audio.js",
      "kind": "source",
      "currentOwner": "browser",
      "replacementPath": "flock-voice-engine/runtime/src/audio/audio-planner.js",
      "replacementOwner": "server",
      "status": "retired",
      "retireAfterGate": "phase6"
    },
    {
      "path": "mvp/src/config.js",
      "kind": "source",
      "currentOwner": "browser",
      "replacementPath": "flock-voice-engine/runtime/src/domain/config.js",
      "replacementOwner": "server",
      "status": "retired",
      "retireAfterGate": "phase6"
    },
    {
      "path": "mvp/src/deterministic-conductor.js",
      "kind": "source",
      "currentOwner": "browser",
      "replacementPath": "flock-voice-engine/runtime/src/domain/deterministic-conductor.js",
      "replacementOwner": "server",
      "status": "retired",
      "retireAfterGate": "phase6"
    },
    {
      "path": "mvp/src/deterministic-rng.js",
      "kind": "source",
      "currentOwner": "browser",
      "replacementPath": "flock-voice-engine/runtime/src/domain/deterministic-rng.js",
      "replacementOwner": "server",
      "status": "retired",
      "retireAfterGate": "phase6"
    },
    {
      "path": "mvp/src/ecological-latent.js",
      "kind": "source",
      "currentOwner": "browser",
      "replacementPath": "flock-voice-engine/runtime/src/latent/latent-runtime.js",
      "replacementOwner": "server",
      "status": "retired",
      "retireAfterGate": "phase6"
    },
    {
      "path": "mvp/src/economy.js",
      "kind": "source",